{
  "version": "0.1",
  "generated_at": "2026-05-21T07:15:00Z",
  "source": "artifact_ops_runner_v0_1",
  "total_artifacts": 11,
  "items": [
    {
      "artifact_id": "ART-EPOCH-005-provider_health_monitor_v0_1",
      "artifact_path": "bridge/reactor_limited_active_r0/live_upgrade_epoch_005/artifacts/provider_health_monitor_v0_1.py",
      "has_tests": true,
      "test_path_expected": "bridge/reactor_limited_active_r0/live_upgrade_epoch_005/artifacts/test_provider_health_monitor.py",
      "risk_if_untested": "HIGH",
      "value_if_tested": "Validates provider health tracking, prevents silent monitoring failures",
      "recommended_action": "IMPROVE_TESTS",
      "priority": 4,
      "status": "READY_R0PLUS",
      "forbidden_actions": ["R1", "main", "deploy", "Supabase"],
      "source_ref": "artifact_ops_runner_v0_1 @ 2026-05-21"
    },
    {
      "artifact_id": "ART-EPOCH-006-memory_analytics_v0_1",
      "artifact_path": "bridge/reactor_limited_active_r0/live_upgrade_epoch_006/artifacts/memory_analytics_v0_1.py",
      "has_tests": true,
      "test_path_expected": "bridge/reactor_limited_active_r0/live_upgrade_epoch_006/artifacts/test_memory_analytics.py",
      "risk_if_untested": "HIGH",
      "value_if_tested": "Validates memory analytics correctness, prevents false pattern detection",
      "recommended_action": "IMPROVE_TESTS",
      "priority": 3,
      "status": "READY_R0PLUS",
      "forbidden_actions": ["R1", "main", "deploy", "Supabase"],
      "source_ref": "artifact_ops_runner_v0_1 @ 2026-05-21"
    },
    {
      "artifact_id": "ART-EPOCH-007-t1_cockpit_data_injector_v0_1",
      "artifact_path": "bridge/reactor_limited_active_r0/live_upgrade_epoch_007/artifacts/t1_cockpit_data_injector_v0_1.py",
      "has_tests": true,
      "test_path_expected": "bridge/reactor_limited_active_r0/live_upgrade_epoch_007/artifacts/test_t1_cockpit_data_injector.py",
      "risk_if_untested": "HIGH",
      "value_if_tested": "Validates T1 data injection accuracy, prevents stale cockpit data",
      "recommended_action": "IMPROVE_TESTS",
      "priority": 2,
      "status": "READY_R0PLUS",
      "forbidden_actions": ["R1", "main", "deploy", "Supabase"],
      "source_ref": "artifact_ops_runner_v0_1 @ 2026-05-21"
    },
    {
      "artifact_id": "ART-EPOCH-008-t1_decision_executor_v0_1",
      "artifact_path": "bridge/reactor_limited_active_r0/live_upgrade_epoch_008/artifacts/t1_decision_executor_v0_1.py",
      "has_tests": true,
      "test_path_expected": "bridge/reactor_limited_active_r0/live_upgrade_epoch_008/artifacts/test_t1_decision_executor.py",
      "risk_if_untested": "CRITICAL",
      "value_if_tested": "Validates decision execution safety, prevents unauthorized state changes",
      "recommended_action": "IMPROVE_TESTS",
      "priority": 1,
      "status": "READY_R0PLUS",
      "forbidden_actions": ["R1", "main", "deploy", "Supabase", "approve_real", "reject_real"],
      "source_ref": "artifact_ops_runner_v0_1 @ 2026-05-21"
    },
    {
      "artifact_id": "ART-SURGE-001-embryo_run_history_analyzer_v0_1",
      "artifact_path": "bridge/r0plus_production_surge_001/artifacts/embryo_run_history_analyzer_v0_1.py",
      "has_tests": true,
      "test_path_expected": "bridge/r0plus_production_surge_001/artifacts/test_embryo_run_history_analyzer.py",
      "risk_if_untested": "HIGH",
      "value_if_tested": "Validates trend detection accuracy, prevents false regression alerts",
      "recommended_action": "IMPROVE_TESTS",
      "priority": 5,
      "status": "DONE",
      "forbidden_actions": ["R1", "main", "deploy", "Supabase"],
      "source_ref": "artifact_ops_runner_v0_1 @ 2026-05-21"
    },
    {
      "artifact_id": "ART-SURGE-001-memory_palace_pattern_detector_v0_1",
      "artifact_path": "bridge/r0plus_production_surge_001/artifacts/memory_palace_pattern_detector_v0_1.py",
      "has_tests": true,
      "test_path_expected": "bridge/r0plus_production_surge_001/artifacts/test_memory_palace_pattern_detector.py",
      "risk_if_untested": "HIGH",
      "value_if_tested": "Validates pattern detection logic, prevents false positives in health reports",
      "recommended_action": "IMPROVE_TESTS",
      "priority": 6,
      "status": "DONE",
      "forbidden_actions": ["R1", "main", "deploy", "Supabase"],
      "source_ref": "artifact_ops_runner_v0_1 @ 2026-05-21"
    },
    {
      "artifact_id": "ART-SURGE-001-r0plus_artifact_indexer_v0_1",
      "artifact_path": "bridge/r0plus_production_surge_001/artifacts/r0plus_artifact_indexer_v0_1.py",
      "has_tests": true,
      "test_path_expected": "bridge/r0plus_production_surge_001/artifacts/test_r0plus_artifact_indexer.py",
      "risk_if_untested": "HIGH",
      "value_if_tested": "Validates artifact discovery and metadata extraction accuracy",
      "recommended_action": "IMPROVE_TESTS",
      "priority": 7,
      "status": "DONE",
      "forbidden_actions": ["R1", "main", "deploy", "Supabase"],
      "source_ref": "artifact_ops_runner_v0_1 @ 2026-05-21"
    },
    {
      "artifact_id": "ART-PROVIDER_OPS-000-provider_migration_guard",
      "artifact_path": "bridge/provider_ops/provider_migration_guard.py",
      "has_tests": true,
      "test_path_expected": "bridge/provider_ops/test_provider_migration_guard.py",
      "risk_if_untested": "CRITICAL",
      "value_if_tested": "Validates EOL detection and migration safety, prevents provider outages",
      "recommended_action": "IMPROVE_TESTS",
      "priority": 8,
      "status": "DONE",
      "forbidden_actions": ["R1", "main", "deploy", "Supabase", "provider_auto_replacement"],
      "source_ref": "artifact_ops_runner_v0_1 @ 2026-05-21"
    },
    {
      "artifact_id": "ART-PROVIDER_OPS-000-provider_registry",
      "artifact_path": "bridge/provider_ops/provider_registry.py",
      "has_tests": true,
      "test_path_expected": "bridge/provider_ops/test_provider_registry.py",
      "risk_if_untested": "HIGH",
      "value_if_tested": "Validates provider registry integrity, prevents stale provider data",
      "recommended_action": "IMPROVE_TESTS",
      "priority": 9,
      "status": "DONE",
      "forbidden_actions": ["R1", "main", "deploy", "Supabase"],
      "source_ref": "artifact_ops_runner_v0_1 @ 2026-05-21"
    },
    {
      "artifact_id": "ART-STATE_FABRIC-000-t1_directive_conflict_resolver",
      "artifact_path": "bridge/state_fabric/t1_directive_conflict_resolver.py",
      "has_tests": true,
      "test_path_expected": "bridge/state_fabric/test_t1_directive_conflict_resolver.py",
      "risk_if_untested": "CRITICAL",
      "value_if_tested": "Validates conflict resolution logic, prevents directive collisions",
      "recommended_action": "IMPROVE_TESTS",
      "priority": 10,
      "status": "DONE",
      "forbidden_actions": ["R1", "main", "deploy", "Supabase"],
      "source_ref": "artifact_ops_runner_v0_1 @ 2026-05-21"
    },
    {
      "artifact_id": "ART-STATE_FABRIC-000-t1_directive_resolver",
      "artifact_path": "bridge/state_fabric/t1_directive_resolver.py",
      "has_tests": true,
      "test_path_expected": "bridge/state_fabric/test_t1_directive_resolver.py",
      "risk_if_untested": "CRITICAL",
      "value_if_tested": "Validates directive resolution and scoring, prevents incorrect task prioritization",
      "recommended_action": "IMPROVE_TESTS",
      "priority": 11,
      "status": "DONE",
      "forbidden_actions": ["R1", "main", "deploy", "Supabase"],
      "source_ref": "artifact_ops_runner_v0_1 @ 2026-05-21"
    }
  ]
}
